Fruit Name,Mass(g),Colour,Rating,Score,Score2,Status
Apple,200,Red,8,400,450.0,discard
Banana,250,Yellow,9,450,512.5,keep
Cantoloupe,600,Orange,10,500,650.0,keep
Cranberry,50, Red,6,300,312.5,discard
Blueberry,20, Blue,9,450,455.0,discard
Strawberry,120, Red,10,500,530.0,discard
Papaya,220, Green,8,400,455.0,discard
Lemon,200, Yellow,9,450,500.0,discard
Avocado,300, Green,7,350,425.0,keep
Jackfruit,500, Yellow,8,400,525.0,keep
